{
  "$schema": "http://json-schema.org/draft-04/schema#",
  "title": "description of the file structure",
  "type": "object",
  "properties": {
    "reference": {
      "type": "string",
      "description": "string id of assemblies reference"
    },
    "genotypes": {
      "type": "array",
      "description": "Optional. Contains names of the genotypes in the file.",
      "items": {
        "type": "string"
      }
    },
    "columns": {
      "type": "array",
      "description": "list of the columns metadata common for all genotypes found in the sample",
      "items": {
        "$ref": "./column_metadata.json"
      }
    },
    "genotype_columns": {
      "type": "array",
      "description": "Optional, absent in case the uploaded VCF file has no genotype columns.",
      "items": {
        "$ref": "./column_metadata.json"
      }
    }
  }
}